Review,Original_Summary,0
finally cat food that my cats are willing to consume without the side effects of diarrhea nausea or vomiting i will continue to purchase unless my kitty cats are requesting something else instead ,they like them they like them , cat food
these are really delicious cookies and they are far healthier than most of the junk in the stores they are full of all natural ingredients no high fructose or additives here i gave a couple of bag,yummy , great cookies
i cannot believe you guys jacked up the price and canceled my order on these we are sorry but your order is not available oh is it not available interesting when i try to buy this for 5 less it se,disappointed , great
i was starting to think that snyder and i just did not share the same idea about what is good in snack flavors i have tried several of their other pretzel pieces flavors buffalo wing and honey mus,snyder s best flavor , yummy
this bar reminds me of the semi sweet chocolate used in baking the chocolate is neither [UNK] on chocolate flavor nor very sweet nor very smooth and creamy my wife the dark chocolate aficionado in,mild and semi sweet , tasty but not as chocolate
the cashew cookie is my favorite flavor of the larabar very tasty i have crohn s disease and am on the scd diet since this is made strictly with nuts and fruit no other additives at all it is a pe,very tasty , delicious
i am happy with this purchase shiitake mushrooms are supposed to be a very healthy food and these 1 oz packages make it easy to keep a supply on hand they taste fine too ,[UNK] , great product
i love these low calorie snacks i count calories and these are so delicious they are great for that [UNK] snack ,delicious , great snack
worst purchase i ever bought off of amazon and i have bought 100 s of items this product smelled like a smelly old closet i threw in trash most disgusting smell had to burn a candle to get smell o,smelled like [UNK] , horrible
i grew up in england moved here when i was 19 many years ago i have always drunk [UNK] i drink many cups of tea a day and this is the best deal i have found ,pg tips is the only tea for me, best tea
disclaimer i am reviewing a package that i received for free through the vine program well it is ok i probably would not buy it but i do not usually buy instant iced tea mixes anyway the fruit fla,ok , not as good as i expected
i make a [UNK] pitcher of this tea for my family just about every day i use 15g of flowers 1 2 oz or a scant 1 2 cup per quart of tea so just about 1 5 cups of flower petals in my mr coffee tea ma,directions for a pitcher , great tea
lovely aroma good for sore throat or calming stomach as well as pure enjoyment my favorite brand of peppermint tea ,wonderful , love this tea
even our vet could not cure the red bumps on my dog s skin the rash and [UNK] was [UNK] to oral antibiotics and [UNK] steroid spray our pet sitter recommended we try a dog food without known aller,mostly cured the red bumps on , great food for a great price
i got my influenster voxbox with awesome products inside one of the products inside was the quaker oaks soft banana nut bar i thoroughly enjoyed this bar it is a great snack that one can have enjo,quaker soft baked cereal banan, great bar
nice boost of energy when you need it and the price is perfect much cheaper than in the stores and other brands ,red rain energy shot , great taste great value
i bought these at a specialty store before ordering them from amazon they did not contain milk at that time i loved them and decided to order a case milk as of the writing of this review is still ,these contain milk , not what i expected
while most liquid is packaged by volume this is packaged by weight i was able to resolve my complaint with amazon but i want other shoppers to be aware that his is smaller than you might expect i ,package size is misleading , good but not the best
i have tried out only two forms of chia seeds and i would have to say the texture of this one is by far the best the other two i have tried either still remained grainy cold pressed and just felt ,a texture , great seeds
seriously get this marinade for all yer pork needs i freakin love stubb s products and this is the only thing i use for my ribs the prices is a bit high but worth it ,amazing marinade , great marinade
i lived in germany for almost 20 years i absolutely fell in love with the [UNK] filled candies they are the very very best anywhere in the world i would highly recommend them and know you will rea,the greatest , great candy
this is the ultimate puppy food the kibbles are great for small breeds high in digestible nutrients as opposed to fillers some companies use less waste results from the high quality ingredients i ,eukanuba puppy small breed dog, great product great price
this is the most amazing dressing in la county you can find it at any of the 6 [UNK] s italian market for 4 99 ,hard to find in stores , great
our standard schnauzer wants that peanut butter pretty bad she is not one for rawhides or treats that involve work the mini schnauzer only seems to like meat treats jack our mini would take the tr,the pups seem to like them , my dog loves them
she loves the beef and also the chicken in the middle bones i like the benefit of cleaning her teeth while she happily chews on them until they are gone ,our dog has a dingo habit , great for training
first off i hate to trash a product that is not only green but made in america however we are less than pleased with this cutting board first off the color of the one we received is way lighter th,good for [UNK] not so much for, great little pricey but not so much
this may not be the most popular hot beverage available on amazon but after trying some through the amazon vine program i like it it is tangy and refreshing and tastes not only of ginger and lemon,tangy and satisfying , the best drink
this extract is excellent and it shipped really fast it is great in blueberry muffins and works well as a fragrance i would also recommend it rather than tasty puff for a delicate flavour in your ,aromatic delicious and delight, great product
i bought a box of the mango macadamia kind bars from amazon since i had not seen that flavor at the stores they have a really delicious fresh fruity tropical sort of taste you can actually recogni,the best gluten free bars , great tasting
very useful culinary ingredient provides tartness and protection from browning use anywhere you would like to use lemon or lime juice but do not want the taste of lemon or lime try mixing a small ,good stuff , lemon lime
this is a great tasting and easy to prepare mac n cheese meal i would consider this the deluxe variety and not the basic type that we find in stores i prepared this vegan style and am sure it woul,great tasting , great taste
i was so looking forward to getting these what a disappointment they were dry stale hard as a rock and had no taste i should have returned them but did not check if you could return food products ,silver lake rum ball gourmet , awful
i am mostly a water drinker but occasionally i like to have a little flavor for my drink the instant lipton tea mix provides that for just ten calories five cal 8 oz it does have sucralose in it b,pleasant taste only 10 calorie, not what i expected
the grilled sirloin flavor was a winner for my dogs it was given mixed with their regular food to enhance and the whole 4 5 pound bag did not last two days the first ingredient listed is beef then,dogs loved it , great for dogs with a
i am a big fan of green tea and i usually drink japanese green tea however supermarkets do not sell japanese brands so i decided to give bigelow tea a try this tea is tasteless i do not understand,very bland , great tea
mae west supposedly said that too much of a good thing is not enough well we bought a case of packages of bugles via amazon s repeat shopper plan which i like probably i should have bought 1 or 2 ,mae west was wrong , not bad
i really have not found a cheez it cracker that i do not like and the mozzarella one s are no different they are mild in flavor and kind of a little creamery tasting than most of the other cheez i,another great cheez it product, not the best
this is a great tasting cereal it has a lasting crunch and the whole family loves it this price is not good at all you can find a larger size for a cheaper price at costco ,great cereal not so good price, great
for the price this is one great cup of coffee i love the fact that the san francisco bay coffee cups for keurig brewers do not have the typical plastic containers i hate throwing away all that pla,great cup of coffee , great coffee
this is the best cereal i like to use it as a base and add more oats nuts and cranberries but it is great by itself too not too sweet no overpowering spices like too much cinnamon and plenty of fi,[UNK] cereal , great cereal
i was recommended this product by a relative of mine but i must say i did not feel it was as spectacular as she made it seem it was not overtly chile ey nor was it very lime ey it was just meh to ,not as amazing as i anticipate, not the best
this was actually pretty good after working out i get very hungry i did not want to eat late so i started taking these and it helped quench the hunger and feed the muscle at the same time ,not bad at all , good stuff
i am very fond of this flavor and my local walmart has opted to not carry it the price is a little higher but not bad the subscribe and save is great wish i could get it on more products ,jello review , great coffee
this is such an enjoyable cup of tea just add a little bit of honey and you are in for a treat i was never a fan of green tea but this has such a good taste it definately changed my opinion and ma,this is the best green tea i h, great tea
these make the other peanut butter cups taste bad once you have the newman s you will never go back the peanut butter is smooth and creamy and then covered in chocolate is amazing these did not la,delicious these did not last l, yummy
i got this in a variety back and this flavor was my least favorite i cannot describe what it tastes like but it is not chocolate or donut ,did not care for it , chocolate
we first discovered these pouches at our local target for 1 09 we had a coupon and thought we would try them with our 11 month old he absolutely loves to eat this flavor straight out of the pouch ,great for the picky eater , great product
these little puppies are so good my wife and i eat a strict diet and most of our diet consists of raw foods these larabar a taste good and they are just dates and cashews you cannot find any other,delish , my dog loves these
just got my shipment it was for the regular [UNK] watermelon not watermelon wave i called and customer service handled this accordingly very satisfied with the way amazon handled the order mix up ,not watermelon [UNK] , great product
i purchased this formula but was worried after reading the comments here that my 5 month old baby would suffer from constipation he did however i really wanted to use organic formula so i added a ,if you are worried about [UNK], not bad
